{
  "type": "View",
  "id": "parent_container",
  "width": "matchParent",
  "height": "matchParent",
  "child": [
    {
      "type": "Label",
      "id": "title_label",
      "text": "Title",
      "width": "matchParent",
      "height": "wrapContent"
    },
    {
      "type": "Button",
      "id": "action_button",
      "text": "Click Me",
      "width": "matchParent",
      "height": "44",
      "alignTopOfView": ""
    },
    {
      "type": "View",
      "id": "content_view",
      "width": "matchParent",
      "height": "wrapContent",
      "alignBottomOfView": "",
      "child": [
        {
          "type": "Label",
          "id": "nested_label",
          "text": "Nested content",
          "width": "matchParent",
          "height": "wrapContent"
        },
        {
          "type": "Image",
          "id": "nested_image",
          "src": "icon",
          "width": "100",
          "height": "100",
          "alignLeftOfView": ""
        }
      ]
    }
  ]
}